{
  "schema_version": "yield-pool-mapping.v1",
  "mapping_version": "2026-10-10.synthetic.1",
  "synthetic": true,
  "description": "Synthetic pool and campaign mapping for offline fixtures. Addresses are 0x000…000N values, not monitored wallets and not live DefiLlama pool ids. A pool id is a UUID. It is not an address.",
  "pools": [
    {
      "pool_id": "11111111-1111-4111-8111-111111111111",
      "chain": "bsc-mainnet",
      "protocol": "synthetic-lend",
      "contracts": [
        {"role": "pool", "address": "0x0000000000000000000000000000000000000001"},
        {"role": "receipt", "address": "0x0000000000000000000000000000000000000002"}
      ]
    },
    {
      "pool_id": "33333333-3333-4333-8333-333333333333",
      "chain": "bsc-mainnet",
      "protocol": "synthetic-zero",
      "contracts": [
        {"role": "pool", "address": "0x0000000000000000000000000000000000000003"}
      ]
    },
    {
      "pool_id": "44444444-4444-4444-8444-444444444444",
      "chain": "bsc-mainnet",
      "protocol": "synthetic-small",
      "contracts": [
        {"role": "pool", "address": "0x0000000000000000000000000000000000000004"}
      ]
    },
    {
      "pool_id": "55555555-5555-4555-8555-555555555555",
      "chain": "bsc-mainnet",
      "protocol": "synthetic-edge",
      "contracts": [
        {"role": "pool", "address": "0x0000000000000000000000000000000000000005"}
      ]
    }
  ],
  "campaigns": [
    {
      "campaign_id": "synthetic-lend-boost-1",
      "pool_id": "11111111-1111-4111-8111-111111111111",
      "source": "explicit_body",
      "product": "synthetic-lend-pool"
    }
  ]
}
